{
  "schema_version": "wonder.reactive-proposal-approval.v1",
  "id": "approval:reactive-proposal:proposal-001",
  "workspace_id": "food-local",
  "actor": "approver",
  "local_actor": "approver",
  "authority": "workspace:food-local",
  "proposal_id": "proposal-001",
  "action_id": "reactive-proposal:proposal-001",
  "idempotency_key": "approval idem altered",
  "proposal_hash": "sha256:961170752fc3e2761655ac3d01bf1be5355b98bb403531de4b8990bdcccc3086",
  "operation_hash": "sha256:efe5ed6ea37d1945f4bad848a8a69afe79f09cf1dd91c317a49df937d3771ffa",
  "operation_template_hash": "sha256:d9420a614d2d0ee28086765abc82824af11639791e3437f11bf55e7682d102bb",
  "targets": [
    {
      "record_id": "food-recipe-001",
      "before_revision": 3,
      "after_revision": 4,
      "before_version_vector": "v1:3",
      "after_version_vector": "v1:4"
    }
  ],
  "scope": {
    "workspace_id": "food-local",
    "package_id": "food",
    "package_version": "1.0.0",
    "domain": "food",
    "collection": "recipe",
    "operation": "update_record",
    "version_vector": "food-local:food-recipe-001:4"
  },
  "created_at": "2026-07-23T00:00:00.000Z",
  "expires_at": "2999-01-01T00:00:00.000Z",
  "decision": {
    "actor": "approver",
    "outcome": "approved",
    "method": "manual",
    "approved_at": "2026-07-23T00:00:01.000Z"
  },
  "source": {
    "kind": "runtime",
    "issued_by": "reactive-runtime",
    "actor": "approver",
    "workspace_id": "food-local",
    "capability": "reactive:propose:update_record",
    "channel": "local-runtime"
  }
}
